{
  "$comment": "GENERATED by contracts/codegen/generate.py from session.schema.yaml - DO NOT EDIT.",
  "$schema": "https://json-schema.org/draft/2020-12/schema",
  "additionalProperties": true,
  "description": "A shift/capture block for a (person, kit) over a time window \u2014 CONTRACT \u00a73.1 (the kit\u2194person binding, OQ-D).",
  "properties": {
    "fob_session_id": {
      "description": "Random per fob boot \u2014 the fob-swap disambiguation key (ingest keys on kit_id+fob_session_id+ordinal).",
      "type": "string"
    },
    "kit_id": {
      "description": "The kit used this shift (the kit\u2194person binding, OQ-D).",
      "type": "string"
    },
    "pause_count": {
      "description": "Number of pauses (scalar; per-pause detail is events, OQ-4).",
      "type": "integer"
    },
    "person_id": {
      "description": "The person on shift (the kit\u2194person binding, OQ-D; resolved/cross-checked at ingest).",
      "type": "string"
    },
    "schema": {
      "description": "Schema identifier; additive semver (\u00a75).",
      "enum": [
        "eunomia-session/v1"
      ],
      "type": "string"
    },
    "session_id": {
      "description": "The session identity (the anchor).",
      "minLength": 1,
      "type": "string"
    },
    "signed_in_at": {
      "description": "Session open time (start of the kit\u2194person window, OQ-6).",
      "type": [
        "string",
        "null"
      ]
    },
    "signed_out_at": {
      "description": "Session close time; null = open (OQ-6).",
      "type": [
        "string",
        "null"
      ]
    },
    "site_id": {
      "description": "Site identity.",
      "type": "string"
    },
    "station_id": {
      "description": "Station identity.",
      "type": "string"
    },
    "task_id": {
      "description": "The task run this session (block-level labeling: one task ~2 hrs).",
      "type": [
        "string",
        "null"
      ]
    },
    "total_pause_ms": {
      "description": "Total paused time in ms (scalar).",
      "type": "number"
    }
  },
  "required": [
    "schema",
    "session_id"
  ],
  "title": "Session",
  "type": "object"
}
